{
  "consent_id": "CONS-001",
  "subject_id": "USER-001",
  "workspace_id": "WS-001",
  "purposes": [
    "workspace recall"
  ],
  "data_classes": [
    "research decisions"
  ],
  "scopes": [
    "WORKSPACE"
  ],
  "decision": "GRANTED",
  "granted_at": "2026-07-26T04:00:00+09:00",
  "expires_at": "2027-07-26T04:00:00+09:00",
  "revoked_at": null,
  "recorded_by": "USER-001",
  "policy_hash": "sha256:aaaaaaaaaaaaaaaaaaaaaaaaaaaaaaaaaaaaaaaaaaaaaaaaaaaaaaaaaaaaaaaa",
  "record_hash": "sha256:bbbbbbbbbbbbbbbbbbbbbbbbbbbbbbbbbbbbbbbbbbbbbbbbbbbbbbbbbbbbbbbb"
}
